url,title,meta_description,meta_keywords,canonical_url,description,error,og:description,og:image,og:title,og:type,robots,theme-color,twitter:card,twitter:description,twitter:image,twitter:title,viewport
# https://example.com,,,,,,No connection adapters were found for '# https://example.com',,,,,,,,,,,
https://www.comicrelief.org,Comic Relief US — Home,"Comic Relief US is an American nonprofit using the power of entertainment to drive positive change toward our vision of a just world, free from poverty.",No keywords,No canonical URL,"Comic Relief US is an American nonprofit using the power of entertainment to drive positive change toward our vision of a just world, free from poverty.",,"Comic Relief US is an American nonprofit using the power of entertainment to drive positive change toward our vision of a just world, free from poverty.",https://cdn.prod.website-files.com/64ef9f67e2a04fa89656701f/651458949e5b67a770af03c1_OG%20Image.png,Comic Relief US — Home,website,,#333,summary_large_image,"Comic Relief US is an American nonprofit using the power of entertainment to drive positive change toward our vision of a just world, free from poverty.",https://cdn.prod.website-files.com/64ef9f67e2a04fa89656701f/651458949e5b67a770af03c1_OG%20Image.png,Comic Relief US — Home,"width=device-width, initial-scale=1"
https://www.comicrelief.org/blog,Comic Relief | Blog,"Read about the real stories of change and community transformation happening all over the U.S. with Comic Relief. For us, the work is live and active.",No keywords,No canonical URL,"Read about the real stories of change and community transformation happening all over the U.S. with Comic Relief. For us, the work is live and active.",,"Read about the real stories of change and community transformation happening all over the U.S. with Comic Relief. For us, the work is live and active.",https://cdn.prod.website-files.com/64ef9f67e2a04fa89656701f/651458949e5b67a770af03c1_OG%20Image.png,Comic Relief | Blog,website,,#333,summary_large_image,"Read about the real stories of change and community transformation happening all over the U.S. with Comic Relief. For us, the work is live and active.",https://cdn.prod.website-files.com/64ef9f67e2a04fa89656701f/651458949e5b67a770af03c1_OG%20Image.png,Comic Relief | Blog,"width=device-width, initial-scale=1"
https://www.comicrelief.org/corporate-partners,Comic Relief US | Corporate Partnerships.,Our corporate partners make it possible for us to help more children and their families break the cycle of poverty and move towards a brighter future.,No keywords,No canonical URL,Our corporate partners make it possible for us to help more children and their families break the cycle of poverty and move towards a brighter future.,,Our corporate partners make it possible for us to help more children and their families break the cycle of poverty and move towards a brighter future.,https://cdn.prod.website-files.com/64ef9f67e2a04fa89656701f/651458949e5b67a770af03c1_OG%20Image.png,Comic Relief US | Corporate Partnerships.,website,"noindex, nofollow",#333,summary_large_image,Our corporate partners make it possible for us to help more children and their families break the cycle of poverty and move towards a brighter future.,https://cdn.prod.website-files.com/64ef9f67e2a04fa89656701f/651458949e5b67a770af03c1_OG%20Image.png,Comic Relief US | Corporate Partnerships.,"width=device-width, initial-scale=1"
https://www.comicrelief.org/financials,Comic Relief | Financials,This year was our biggest year yet. Read Comic Relief's Financial Reports.,No keywords,No canonical URL,This year was our biggest year yet. Read Comic Relief's Financial Reports.,,This year was our biggest year yet. Read Comic Relief's Financial Reports.,https://cdn.prod.website-files.com/64ef9f67e2a04fa89656701f/651458949e5b67a770af03c1_OG%20Image.png,Comic Relief | Financials,website,,#333,summary_large_image,This year was our biggest year yet. Read Comic Relief's Financial Reports.,https://cdn.prod.website-files.com/64ef9f67e2a04fa89656701f/651458949e5b67a770af03c1_OG%20Image.png,Comic Relief | Financials,"width=device-width, initial-scale=1"
https://www.comicrelief.org/live,Comic Relief Live 2025,Comic Relief Live 2025 — A benefit to build brighter futures for kids. Hosted by John Oliver. Honoring Trevor Noah and Kristin Lemkau. December 10 at Carnegie Hall.,No keywords,No canonical URL,Comic Relief Live 2025 — A benefit to build brighter futures for kids. Hosted by John Oliver. Honoring Trevor Noah and Kristin Lemkau. December 10 at Carnegie Hall.,,Comic Relief Live 2025 — A benefit to build brighter futures for kids. Hosted by John Oliver. Honoring Trevor Noah and Kristin Lemkau. December 10 at Carnegie Hall.,https://cdn.prod.website-files.com/64ef9f67e2a04fa89656701f/68642152aa8ef0e620fe298a_Comic-Relief-Live-Save-The-Date_EmailHeader_36-min.png,Comic Relief Live 2025,website,,#333,summary_large_image,Comic Relief Live 2025 — A benefit to build brighter futures for kids. Hosted by John Oliver. Honoring Trevor Noah and Kristin Lemkau. December 10 at Carnegie Hall.,https://cdn.prod.website-files.com/64ef9f67e2a04fa89656701f/68642152aa8ef0e620fe298a_Comic-Relief-Live-Save-The-Date_EmailHeader_36-min.png,Comic Relief Live 2025,"width=device-width, initial-scale=1"
https://www.comicrelief.org/get-involved,Comic Relief | Get Involved,"Everyone has a different style of giving. Whether you're a teacher, brand,  gamer, or all-around generous person, find the best way to lend your support.",No keywords,No canonical URL,"Everyone has a different style of giving. Whether you're a teacher, brand,  gamer, or all-around generous person, find the best way to lend your support.",,"Everyone has a different style of giving. Whether you're a teacher, brand,  gamer, or all-around generous person, find the best way to lend your support.",https://cdn.prod.website-files.com/64ef9f67e2a04fa89656701f/651458949e5b67a770af03c1_OG%20Image.png,Comic Relief | Get Involved,website,,#333,summary_large_image,"Everyone has a different style of giving. Whether you're a teacher, brand,  gamer, or all-around generous person, find the best way to lend your support.",https://cdn.prod.website-files.com/64ef9f67e2a04fa89656701f/651458949e5b67a770af03c1_OG%20Image.png,Comic Relief | Get Involved,"width=device-width, initial-scale=1"
https://www.comicrelief.org/press,Comic Relief | Press,The place for all things press. Want to see our recent press releases or reach out with an inquiry? This is where to do it. Thank you for helping to spread the mission of Comic Relief.,No keywords,No canonical URL,The place for all things press. Want to see our recent press releases or reach out with an inquiry? This is where to do it. Thank you for helping to spread the mission of Comic Relief.,,The place for all things press. Want to see our recent press releases or reach out with an inquiry? This is where to do it. Thank you for helping to spread the mission of Comic Relief.,https://cdn.prod.website-files.com/64ef9f67e2a04fa89656701f/651458949e5b67a770af03c1_OG%20Image.png,Comic Relief | Press,website,,#333,summary_large_image,The place for all things press. Want to see our recent press releases or reach out with an inquiry? This is where to do it. Thank you for helping to spread the mission of Comic Relief.,https://cdn.prod.website-files.com/64ef9f67e2a04fa89656701f/651458949e5b67a770af03c1_OG%20Image.png,Comic Relief | Press,"width=device-width, initial-scale=1"
https://www.comicrelief.org/search,Search Results,No description,No keywords,No canonical URL,,,,,Search Results,,,#333,,,,Search Results,"width=device-width, initial-scale=1"
https://www.comicrelief.org/sign-up,Comic Relief | Sign Up,Ready to put poverty in our past? Sign up for updates on the work Comic Relief is doing and how you can use your unique gifts to contribute to the mission.,No keywords,No canonical URL,Ready to put poverty in our past? Sign up for updates on the work Comic Relief is doing and how you can use your unique gifts to contribute to the mission.,,Ready to put poverty in our past? Sign up for updates on the work Comic Relief is doing and how you can use your unique gifts to contribute to the mission.,https://cdn.prod.website-files.com/64ef9f67e2a04fa89656701f/651458949e5b67a770af03c1_OG%20Image.png,Comic Relief | Sign Up,website,,#333,summary_large_image,Ready to put poverty in our past? Sign up for updates on the work Comic Relief is doing and how you can use your unique gifts to contribute to the mission.,https://cdn.prod.website-files.com/64ef9f67e2a04fa89656701f/651458949e5b67a770af03c1_OG%20Image.png,Comic Relief | Sign Up,"width=device-width, initial-scale=1"
https://www.comicrelief.org/what-we-do,Comic Relief | Approach,"We're empowering communities, fostering equity, and setting individuals up for economic success. Learn about how we're making poverty a thing of the past.",No keywords,No canonical URL,"We're empowering communities, fostering equity, and setting individuals up for economic success. Learn about how we're making poverty a thing of the past.",,"We're empowering communities, fostering equity, and setting individuals up for economic success. Learn about how we're making poverty a thing of the past.",https://cdn.prod.website-files.com/64ef9f67e2a04fa89656701f/651458949e5b67a770af03c1_OG%20Image.png,Comic Relief | Approach,website,,#333,summary_large_image,"We're empowering communities, fostering equity, and setting individuals up for economic success. Learn about how we're making poverty a thing of the past.",https://cdn.prod.website-files.com/64ef9f67e2a04fa89656701f/651458949e5b67a770af03c1_OG%20Image.png,Comic Relief | Approach,"width=device-width, initial-scale=1"
https://www.comicrelief.org/who-we-are,Comic Relief | About,"Our goal is to end poverty. This is an ambitious goal, but so are we. Learn about the long-term solutions we're implementing to solve our nation's poverty problem.",No keywords,No canonical URL,"Our goal is to end poverty. This is an ambitious goal, but so are we. Learn about the long-term solutions we're implementing to solve our nation's poverty problem.",,"Our goal is to end poverty. This is an ambitious goal, but so are we. Learn about the long-term solutions we're implementing to solve our nation's poverty problem.",https://cdn.prod.website-files.com/64ef9f67e2a04fa89656701f/651458949e5b67a770af03c1_OG%20Image.png,Comic Relief | About,website,,#333,summary_large_image,"Our goal is to end poverty. This is an ambitious goal, but so are we. Learn about the long-term solutions we're implementing to solve our nation's poverty problem.",https://cdn.prod.website-files.com/64ef9f67e2a04fa89656701f/651458949e5b67a770af03c1_OG%20Image.png,Comic Relief | About,"width=device-width, initial-scale=1"
https://www.comicrelief.org/give/rnd-critical-role,Red Nose Day & Critical Role,"Comic Relief US is an American nonprofit using the power of entertainment to drive positive change toward our vision of a just world, free from poverty.",No keywords,No canonical URL,"Comic Relief US is an American nonprofit using the power of entertainment to drive positive change toward our vision of a just world, free from poverty.",,"Comic Relief US is an American nonprofit using the power of entertainment to drive positive change toward our vision of a just world, free from poverty.",https://cdn.prod.website-files.com/64ef9f67e2a04fa89656701f/651458949e5b67a770af03c1_OG%20Image.png,Red Nose Day & Critical Role,website,,#333,summary_large_image,"Comic Relief US is an American nonprofit using the power of entertainment to drive positive change toward our vision of a just world, free from poverty.",https://cdn.prod.website-files.com/64ef9f67e2a04fa89656701f/651458949e5b67a770af03c1_OG%20Image.png,Red Nose Day & Critical Role,"width=device-width, initial-scale=1"
https://www.comicrelief.org/give/hikma,Hikma & Red Nose Day,"Hikma and Red Nose Day are committed to reducing childhood poverty so more kids have access to high-quality education and healthcare, safe and supportive places to live, and are empowered to chase their dreams.",No keywords,No canonical URL,"Hikma and Red Nose Day are committed to reducing childhood poverty so more kids have access to high-quality education and healthcare, safe and supportive places to live, and are empowered to chase their dreams.",,"Hikma and Red Nose Day are committed to reducing childhood poverty so more kids have access to high-quality education and healthcare, safe and supportive places to live, and are empowered to chase their dreams.",https://cdn.prod.website-files.com/64ef9f67e2a04fa89656701f/65ef83b3336df1a8a0927de4_HIKMA_hero_1600x780_2x.avif,Hikma & Red Nose Day,website,,#333,summary_large_image,"Hikma and Red Nose Day are committed to reducing childhood poverty so more kids have access to high-quality education and healthcare, safe and supportive places to live, and are empowered to chase their dreams.",https://cdn.prod.website-files.com/64ef9f67e2a04fa89656701f/65ef83b3336df1a8a0927de4_HIKMA_hero_1600x780_2x.avif,Hikma & Red Nose Day,"width=device-width, initial-scale=1"
https://www.comicrelief.org/red-nose-day/impact/educated,Red Nose Day Impact: Education | Comic Relief US,"Red Nose Day focuses on targeted, evidence-based educational interventions that can give every child the best chance to succeed in school, and in the future.",No keywords,No canonical URL,"Red Nose Day focuses on targeted, evidence-based educational interventions that can give every child the best chance to succeed in school, and in the future.",,"Red Nose Day focuses on targeted, evidence-based educational interventions that can give every child the best chance to succeed in school, and in the future.",https://cdn.prod.website-files.com/64ef9f67e2a04fa89656701f/651458949e5b67a770af03c1_OG%20Image.png,Red Nose Day Impact: Education | Comic Relief US,website,,#333,summary_large_image,"Red Nose Day focuses on targeted, evidence-based educational interventions that can give every child the best chance to succeed in school, and in the future.",https://cdn.prod.website-files.com/64ef9f67e2a04fa89656701f/651458949e5b67a770af03c1_OG%20Image.png,Red Nose Day Impact: Education | Comic Relief US,"width=device-width, initial-scale=1"
https://www.comicrelief.org/red-nose-day/impact/healthy,Red Nose Day Impact: Health | Comic Relief US,Red Nose Day believes it is possible for all children to grow up safe from preventable and treatable health problems.,No keywords,No canonical URL,Red Nose Day believes it is possible for all children to grow up safe from preventable and treatable health problems.,,Red Nose Day believes it is possible for all children to grow up safe from preventable and treatable health problems.,https://cdn.prod.website-files.com/64ef9f67e2a04fa89656701f/651458949e5b67a770af03c1_OG%20Image.png,Red Nose Day Impact: Health | Comic Relief US,website,,#333,summary_large_image,Red Nose Day believes it is possible for all children to grow up safe from preventable and treatable health problems.,https://cdn.prod.website-files.com/64ef9f67e2a04fa89656701f/651458949e5b67a770af03c1_OG%20Image.png,Red Nose Day Impact: Health | Comic Relief US,"width=device-width, initial-scale=1"
https://www.comicrelief.org/red-nose-day/impact/safe,Red Nose Day Impact: Safety | Comic Relief US,"Red Nose Day believes that targeted programs can change the trajectory for homeless children and street-connected youth on the move, helping to provide physical and mental safety, and the tools and resources they need to overcome their challenges.",No keywords,No canonical URL,"Red Nose Day believes that targeted programs can change the trajectory for homeless children and street-connected youth on the move, helping to provide physical and mental safety, and the tools and resources they need to overcome their challenges.",,"Red Nose Day believes that targeted programs can change the trajectory for homeless children and street-connected youth on the move, helping to provide physical and mental safety, and the tools and resources they need to overcome their challenges.",https://cdn.prod.website-files.com/64ef9f67e2a04fa89656701f/651458949e5b67a770af03c1_OG%20Image.png,Red Nose Day Impact: Safety | Comic Relief US,website,,#333,summary_large_image,"Red Nose Day believes that targeted programs can change the trajectory for homeless children and street-connected youth on the move, helping to provide physical and mental safety, and the tools and resources they need to overcome their challenges.",https://cdn.prod.website-files.com/64ef9f67e2a04fa89656701f/651458949e5b67a770af03c1_OG%20Image.png,Red Nose Day Impact: Safety | Comic Relief US,"width=device-width, initial-scale=1"
https://www.comicrelief.org/red-nose-day/red-nose-day-filter,Get the Red Nose Day USA Social Media Filter,How to use the Red Nose Day USA filter on your social media profile.,No keywords,No canonical URL,How to use the Red Nose Day USA filter on your social media profile.,,How to use the Red Nose Day USA filter on your social media profile.,https://cdn.prod.website-files.com/64ef9f67e2a04fa89656701f/662aaab83b869f6f31bfa49a_2024_CRUS_RND_Header-1480.jpg,Get the Red Nose Day USA Social Media Filter,website,,#333,summary_large_image,How to use the Red Nose Day USA filter on your social media profile.,https://cdn.prod.website-files.com/64ef9f67e2a04fa89656701f/662aaab83b869f6f31bfa49a_2024_CRUS_RND_Header-1480.jpg,Get the Red Nose Day USA Social Media Filter,"width=device-width, initial-scale=1"
https://www.comicrelief.org/red-nose-day/dreamstakes-rules,Dreamstakes Rules,No description,No keywords,No canonical URL,,,,,Dreamstakes Rules,,,#333,,,,Dreamstakes Rules,"width=device-width, initial-scale=1"
https://www.comicrelief.org/red-nose-day/thank-you,Thank You,Your donation means you're now a part of our movement to help make childhood poverty a thing of the past and help all kids have more opportunities.,No keywords,No canonical URL,Your donation means you're now a part of our movement to help make childhood poverty a thing of the past and help all kids have more opportunities.,,Your donation means you're now a part of our movement to help make childhood poverty a thing of the past and help all kids have more opportunities.,https://cdn.prod.website-files.com/64ef9f67e2a04fa89656701f/65660bcfa637a7c5fa4f7c56_RNDH-social.jpg,Thank You,website,,#333,summary_large_image,Your donation means you're now a part of our movement to help make childhood poverty a thing of the past and help all kids have more opportunities.,https://cdn.prod.website-files.com/64ef9f67e2a04fa89656701f/65660bcfa637a7c5fa4f7c56_RNDH-social.jpg,Thank You,"width=device-width, initial-scale=1"
https://www.comicrelief.org/red-nose-day/sweeps-thank-you-for-entering,Not Found,No description,No keywords,No canonical URL,,,,,Not Found,,,#333,,,,Not Found,"width=device-width, initial-scale=1"
https://www.comicrelief.org/campaigns/innovation-growth-fund,Comic Relief | Innovation & Growth Fund,"At Comic Relief, we are committed to finding solutions that generate equality and uplift communities. We focus on addressing the causes — not just the consequences — of systemic poverty.",No keywords,No canonical URL,"At Comic Relief, we are committed to finding solutions that generate equality and uplift communities. We focus on addressing the causes — not just the consequences — of systemic poverty.",,"At Comic Relief, we are committed to finding solutions that generate equality and uplift communities. We focus on addressing the causes — not just the consequences — of systemic poverty.",https://cdn.prod.website-files.com/64ef9f67e2a04fa89656701f/651458949e5b67a770af03c1_OG%20Image.png,Comic Relief | Innovation & Growth Fund,website,,#333,summary_large_image,"At Comic Relief, we are committed to finding solutions that generate equality and uplift communities. We focus on addressing the causes — not just the consequences — of systemic poverty.",https://cdn.prod.website-files.com/64ef9f67e2a04fa89656701f/651458949e5b67a770af03c1_OG%20Image.png,Comic Relief | Innovation & Growth Fund,"width=device-width, initial-scale=1"
https://www.comicrelief.org/campaigns/red-nose-day,Red Nose Day | Comic Relief US,"Red Nose Day has raised more than $324 million, impacting the lives of over 31 million children. Learn more.",No keywords,No canonical URL,"Red Nose Day has raised more than $324 million, impacting the lives of over 31 million children. Learn more.",,"Red Nose Day has raised more than $324 million, impacting the lives of over 31 million children. Learn more.",https://cdn.prod.website-files.com/64ef9f67e2a04fa89656701f/651458949e5b67a770af03c1_OG%20Image.png,Red Nose Day | Comic Relief US,website,,#333,summary_large_image,"Red Nose Day has raised more than $324 million, impacting the lives of over 31 million children. Learn more.",https://cdn.prod.website-files.com/64ef9f67e2a04fa89656701f/651458949e5b67a770af03c1_OG%20Image.png,Red Nose Day | Comic Relief US,"width=device-width, initial-scale=1"
https://www.comicrelief.org/campaigns/childhood-dreamstakes-2024,Childhood Dreamstakes 2024,"This Red Nose Day is going to be dream-tastic! Donate to Red Nose Day to stand a chance to win a fun wacky, experience inspired by childhood dreams.",No keywords,No canonical URL,"This Red Nose Day is going to be dream-tastic! Donate to Red Nose Day to stand a chance to win a fun wacky, experience inspired by childhood dreams.",,"This Red Nose Day is going to be dream-tastic! Donate to Red Nose Day to stand a chance to win a fun wacky, experience inspired by childhood dreams.",,Childhood Dreamstakes 2024,website,,#333,summary_large_image,"This Red Nose Day is going to be dream-tastic! Donate to Red Nose Day to stand a chance to win a fun wacky, experience inspired by childhood dreams.",,Childhood Dreamstakes 2024,"width=device-width, initial-scale=1"
https://www.comicrelief.org/who-we-are/board,Comic Relief | Board of Directors,The Comic Relief Board oversees the strategic and financial health of the organization and is responsible for approving distribution of grants to our grantee partners.,No keywords,No canonical URL,The Comic Relief Board oversees the strategic and financial health of the organization and is responsible for approving distribution of grants to our grantee partners.,,The Comic Relief Board oversees the strategic and financial health of the organization and is responsible for approving distribution of grants to our grantee partners.,https://cdn.prod.website-files.com/64ef9f67e2a04fa89656701f/651458949e5b67a770af03c1_OG%20Image.png,Comic Relief | Board of Directors,website,,#333,summary_large_image,The Comic Relief Board oversees the strategic and financial health of the organization and is responsible for approving distribution of grants to our grantee partners.,https://cdn.prod.website-files.com/64ef9f67e2a04fa89656701f/651458949e5b67a770af03c1_OG%20Image.png,Comic Relief | Board of Directors,"width=device-width, initial-scale=1"
https://www.comicrelief.org/who-we-are/staff,Comic Relief | Our Staff,Our staff is a dedicated group of unique individuals committed to the collective goal of helping others and having fun along the way. Get to know the people behind the laughs.,No keywords,No canonical URL,Our staff is a dedicated group of unique individuals committed to the collective goal of helping others and having fun along the way. Get to know the people behind the laughs.,,Our staff is a dedicated group of unique individuals committed to the collective goal of helping others and having fun along the way. Get to know the people behind the laughs.,https://cdn.prod.website-files.com/64ef9f67e2a04fa89656701f/651458949e5b67a770af03c1_OG%20Image.png,Comic Relief | Our Staff,website,,#333,summary_large_image,Our staff is a dedicated group of unique individuals committed to the collective goal of helping others and having fun along the way. Get to know the people behind the laughs.,https://cdn.prod.website-files.com/64ef9f67e2a04fa89656701f/651458949e5b67a770af03c1_OG%20Image.png,Comic Relief | Our Staff,"width=device-width, initial-scale=1"
https://www.comicrelief.org/who-we-are/youth-advisory-council,Comic Relief | Youth Advisory Council,"This effort empowers voices from the communities that are most impacted by poverty, systemic inequity, and injustice. Learn more about the council's work.",No keywords,No canonical URL,"This effort empowers voices from the communities that are most impacted by poverty, systemic inequity, and injustice. Learn more about the council's work.",,"This effort empowers voices from the communities that are most impacted by poverty, systemic inequity, and injustice. Learn more about the council's work.",https://cdn.prod.website-files.com/64ef9f67e2a04fa89656701f/651458949e5b67a770af03c1_OG%20Image.png,Comic Relief | Youth Advisory Council,website,,#333,summary_large_image,"This effort empowers voices from the communities that are most impacted by poverty, systemic inequity, and injustice. Learn more about the council's work.",https://cdn.prod.website-files.com/64ef9f67e2a04fa89656701f/651458949e5b67a770af03c1_OG%20Image.png,Comic Relief | Youth Advisory Council,"width=device-width, initial-scale=1"
